{"grao":"1 linha por subconjunto de segmentos × ligação desenhada da rede; período 13s","dimensoes":{"subconjunto":["todos","Fiéis","Regulares","Fiéis+Regulares","Esporádicos","Fiéis+Esporádicos","Regulares+Esporádicos","Fiéis+Regulares+Esporádicos","Em pausa","Fiéis+Em pausa","Regulares+Em pausa","Fiéis+Regulares+Em pausa","Esporádicos+Em pausa","Fiéis+Esporádicos+Em pausa","Regulares+Esporádicos+Em pausa","Fiéis+Regulares+Esporádicos+Em pausa"]},"colunas":["subconjunto","no_a","no_b","cestas_par","lift","indice","amostra_pequena"],"linhas":[[0,0,5,3074,1.7505,1.0,false],[0,0,12,517,1.2891,1.0,false],[0,0,33,1331,1.7059,1.0,false],[0,0,43,912,1.7165,1.0,false],[0,1,16,903,3.4658,1.0,false],[0,1,43,891,3.1311,1.0,false],[0,1,60,103,1.1543,1.0,true],[0,1,63,910,3.302,1.0,false],[0,2,9,2531,2.2589,1.0,false],[0,2,43,1149,2.04,1.0,false],[0,2,51,2719,2.1218,1.0,false],[0,3,39,1306,2.8158,1.0,false],[0,3,55,1715,2.8107,1.0,false],[0,3,63,1074,2.8456,1.0,false],[0,4,6,1078,3.1393,1.0,false],[0,4,32,393,3.2347,1.0,false],[0,4,40,561,2.849,1.0,false],[0,4,76,146,1.2759,1.0,true],[0,5,35,901,2.3453,1.0,false],[0,5,39,1060,2.6204,1.0,false],[0,5,55,1257,2.3621,1.0,false],[0,5,60,130,1.2198,1.0,true],[0,6,12,166,1.1287,1.0,true],[0,6,26,118,1.677,1.0,true],[0,6,32,478,3.6592,1.0,false],[0,6,43,665,3.4128,1.0,false],[0,7,11,1568,2.5974,1.0,false],[0,7,35,1306,2.4599,1.0,false],[0,7,43,1151,2.4506,1.0,false],[0,8,12,188,2.1988,1.0,true],[0,8,22,163,3.6158,1.0,true],[0,8,34,171,1.6942,1.0,true],[0,9,26,120,1.6244,1.0,true],[0,9,30,902,3.9267,1.0,false],[0,9,43,615,3.0062,1.0,false],[0,9,68,555,3.0911,1.0,false],[0,10,35,861,3.401,1.0,false],[0,10,43,793,3.5407,1.0,false],[0,10,58,778,3.2081,1.0,false],[0,10,64,184,1.4454,1.0,true],[0,10,77,110,1.1712,1.0,true],[0,11,34,1000,8.4912,1.0,false],[0,11,47,306,2.7587,1.0,false],[0,11,69,238,2.6689,1.0,false],[0,11,76,108,1.2941,1.0,true],[0,13,27,331,2.9761,1.0,false],[0,13,32,381,3.0517,1.0,false],[0,13,43,579,3.1091,1.0,false],[0,14,16,433,4.1131,1.0,false],[0,14,58,444,3.5663,1.0,false],[0,14,79,106,3.8014,1.0,true],[0,15,30,451,2.0578,1.0,false],[0,15,62,362,2.0116,1.0,false],[0,15,71,244,2.0655,1.0,false],[0,15,72,164,1.562,1.0,true],[0,16,27,248,4.4102,1.0,false],[0,16,47,314,3.9738,1.0,false],[0,16,59,233,3.6971,1.0,false],[0,16,67,129,3.7387,1.0,true],[0,17,26,130,2.0634,1.0,true],[0,17,30,652,3.3281,1.0,false],[0,17,48,589,3.0325,1.0,false],[0,17,64,124,1.2504,1.0,true],[0,17,68,456,2.9779,1.0,false],[0,18,36,387,2.2051,1.0,false],[0,18,60,113,2.5086,1.0,true],[0,18,73,204,2.4014,1.0,false],[0,19,31,169,2.8495,1.0,true],[0,19,47,212,2.6143,1.0,false],[0,19,68,234,2.7591,1.0,false],[0,20,29,679,2.7348,1.0,false],[0,20,44,460,2.5558,1.0,false],[0,20,47,468,2.9744,1.0,false],[0,20,64,153,1.4357,1.0,true],[0,21,22,129,1.6664,1.0,true],[0,21,30,675,3.0903,1.0,false],[0,21,35,698,3.1745,1.0,false],[0,21,36,728,3.0634,1.0,false],[0,21,43,657,3.3775,1.0,false],[0,21,72,174,1.6629,1.0,true],[0,22,57,139,1.3723,1.0,true],[0,23,43,802,3.9586,1.0,false],[0,23,48,879,3.8973,1.0,false],[0,23,58,867,3.9522,1.0,false],[0,23,77,113,1.3301,1.0,true],[0,24,31,292,4.2493,1.0,false],[0,24,46,333,3.3828,1.0,false],[0,24,66,146,2.6739,1.0,true],[0,24,74,595,6.7313,1.0,false],[0,25,30,384,2.5368,1.0,false],[0,25,69,234,2.5728,1.0,false],[0,25,74,287,2.6965,1.0,false],[0,27,32,184,4.4688,1.0,true],[0,27,40,231,3.4616,1.0,false],[0,27,43,244,3.9729,1.0,false],[0,27,47,203,3.9386,1.0,false],[0,27,53,298,3.6581,1.0,false],[0,27,59,157,3.8192,1.0,true],[0,28,31,104,2.7663,1.0,true],[0,28,66,147,4.9208,1.0,true],[0,28,74,138,2.8536,1.0,true],[0,29,30,535,3.4987,1.0,false],[0,29,54,489,3.4793,1.0,false],[0,29,57,1037,3.0768,1.0,false],[0,29,69,317,3.4502,1.0,false],[0,30,32,292,3.772,1.0,false],[0,30,33,539,3.1786,1.0,false],[0,30,36,476,3.3742,1.0,false],[0,30,43,448,3.8797,1.0,false],[0,30,71,106,1.5167,1.0,true],[0,30,73,213,3.1193,1.0,false],[0,31,45,141,3.6554,1.0,true],[0,31,46,214,3.8559,1.0,false],[0,31,56,186,5.289,1.0,true],[0,31,61,144,3.7694,1.0,true],[0,31,74,247,4.9564,1.0,false],[0,32,33,315,3.1114,1.0,false],[0,32,35,306,3.9267,1.0,false],[0,32,38,161,3.9172,1.0,true],[0,32,43,309,4.482,1.0,false],[0,32,63,283,4.2384,1.0,false],[0,32,73,118,2.8944,1.0,true],[0,33,35,522,3.058,1.0,false],[0,34,49,289,2.9042,1.0,false],[0,34,54,280,2.9608,1.0,false],[0,35,43,630,5.4198,1.0,false],[0,35,63,435,3.864,1.0,false],[0,36,48,433,3.0959,1.0,false],[0,36,72,121,1.7904,1.0,true],[0,38,40,245,3.678,1.0,false],[0,38,58,229,3.4497,1.0,false],[0,39,49,516,3.882,1.0,false],[0,39,55,689,3.5954,1.0,false],[0,39,58,506,3.8181,1.0,false],[0,39,63,453,3.8216,1.0,false],[0,40,58,392,3.24,1.0,false],[0,41,65,611,3.8551,1.0,false],[0,41,67,168,3.6683,1.0,true],[0,41,79,109,3.5963,1.0,true],[0,42,43,399,3.1132,1.0,false],[0,42,44,486,3.9503,1.0,false],[0,42,47,382,3.5517,1.0,false],[0,43,48,503,4.3937,1.0,false],[0,43,50,419,3.3586,1.0,false],[0,43,58,536,4.8136,1.0,false],[0,43,63,461,4.6287,1.0,false],[0,43,68,326,3.6119,1.0,false],[0,43,79,79,3.1676,1.0,true],[0,44,47,428,5.1663,1.0,false],[0,44,51,754,3.3572,1.0,false],[0,44,59,263,3.9803,1.0,false],[0,45,56,119,3.3986,1.0,true],[0,45,61,179,4.7061,1.0,true],[0,46,56,166,3.295,1.0,true],[0,46,74,311,4.3563,1.0,false],[0,47,51,737,3.7536,1.0,false],[0,48,58,501,4.0415,1.0,false],[0,48,68,357,3.553,1.0,false],[0,48,69,293,3.7934,1.0,false],[0,48,73,176,2.5997,1.0,true],[0,49,52,522,4.0848,1.0,false],[0,49,55,520,2.9738,1.0,false],[0,49,65,618,4.3635,1.0,false],[0,50,52,579,4.0561,1.0,false],[0,50,53,691,4.1759,1.0,false],[0,50,76,139,1.7646,1.0,true],[0,51,70,605,2.89,1.0,false],[0,52,55,514,2.7899,1.0,false],[0,52,65,511,3.4244,1.0,false],[0,53,78,329,3.5386,1.0,false],[0,54,57,977,3.7195,1.0,false],[0,54,69,313,4.3711,1.0,false],[0,54,71,116,1.8059,1.0,true],[0,56,61,122,3.5181,1.0,true],[0,56,74,193,4.2664,1.0,true],[0,57,69,612,3.5641,1.0,false],[0,57,77,145,1.3586,1.0,true],[0,58,63,448,4.1542,1.0,false],[0,58,67,145,3.5535,1.0,true],[0,62,70,418,4.927,1.0,false],[0,62,75,303,4.0257,1.0,false],[0,62,78,261,4.0384,1.0,false],[0,63,68,312,3.5693,1.0,false],[0,65,79,124,3.9205,1.0,true],[0,66,74,125,3.1566,1.0,true],[0,70,75,249,3.409,1.0,false],[0,70,78,266,4.2411,1.0,false],[0,75,78,288,5.1759,1.0,false],[1,0,5,2228,1.73,0.9883,false],[1,0,12,393,1.2421,0.9635,false],[1,0,33,949,1.7022,0.9978,false],[1,0,43,626,1.6834,0.9807,false],[1,1,16,571,3.3298,0.9607,false],[1,1,43,585,3.0714,0.9809,false],[1,1,60,71,1.2432,1.077,true],[1,1,63,638,3.3815,1.0241,false],[1,2,9,1733,2.2653,1.0028,false],[1,2,43,782,2.0733,1.0163,false],[1,2,51,1857,2.1734,1.0243,false],[1,3,39,939,2.7973,0.9934,false],[1,3,55,1241,2.8507,1.0142,false],[1,3,63,759,2.8488,1.0011,false],[1,4,6,725,3.1391,0.9999,false],[1,4,32,266,3.2036,0.9904,false],[1,4,40,407,2.8801,1.0109,false],[1,4,76,87,1.0623,0.8326,true],[1,5,35,621,2.2907,0.9767,false],[1,5,39,764,2.586,0.9869,false],[1,5,55,904,2.3595,0.9989,false],[1,5,60,92,1.2962,1.0626,true],[1,6,12,119,1.0661,0.9446,true],[1,6,26,99,1.8815,1.1219,true],[1,6,32,321,3.5466,0.9692,false],[1,6,43,419,3.194,0.9359,false],[1,7,11,1124,2.5952,0.9991,false],[1,7,35,905,2.4934,1.0136,false],[1,7,43,769,2.4264,0.9901,false],[1,8,12,140,1.9992,0.9092,true],[1,8,22,128,3.4102,0.9431,true],[1,8,34,130,1.6562,0.9776,true],[1,9,26,93,1.6724,1.0296,true],[1,9,30,656,4.0376,1.0282,false],[1,9,43,406,2.9284,0.9741,false],[1,9,68,378,3.1549,1.0207,false],[1,10,35,622,3.5003,1.0292,false],[1,10,43,541,3.4866,0.9847,false],[1,10,58,551,3.2547,1.0145,false],[1,10,64,142,1.4928,1.0328,true],[1,10,77,83,1.2762,1.0896,true],[1,11,34,724,8.1271,0.9571,false],[1,11,47,234,2.8444,1.0311,false],[1,11,69,176,2.7433,1.0279,true],[1,11,76,83,1.3057,1.0089,true],[1,13,27,232,3.0118,1.012,false],[1,13,32,270,3.1024,1.0166,false],[1,13,43,380,3.0125,0.9689,false],[1,14,16,284,3.9752,0.9665,false],[1,14,58,311,3.5921,1.0072,false],[1,14,79,85,4.1353,1.0878,true],[1,15,30,320,1.9703,0.9575,false],[1,15,62,265,1.9489,0.9688,false],[1,15,71,184,2.0306,0.9831,true],[1,15,72,118,1.5129,0.9686,true],[1,16,27,161,4.2841,0.9714,true],[1,16,47,214,3.9485,0.9936,false],[1,16,59,150,3.5816,0.9688,true],[1,16,67,81,3.8284,1.024,true],[1,17,26,89,1.8091,0.8768,true],[1,17,30,476,3.3116,0.9951,false],[1,17,48,440,3.1218,1.0295,false],[1,17,64,99,1.3167,1.053,true],[1,17,68,314,2.9624,0.9948,false],[1,18,36,257,2.1255,0.9639,false],[1,18,60,70,2.4445,0.9744,true],[1,18,73,135,2.4173,1.0066,true],[1,19,31,126,2.7619,0.9693,true],[1,19,47,153,2.5198,0.9639,true],[1,19,68,164,2.7525,0.9976,true],[1,20,29,439,2.62,0.958,false],[1,20,44,323,2.6024,1.0182,false],[1,20,47,343,3.1034,1.0434,false],[1,20,64,114,1.4818,1.0321,true],[1,21,22,102,1.6973,1.0186,true],[1,21,30,492,3.186,1.031,false],[1,21,35,478,3.1675,0.9978,false],[1,21,36,524,3.1408,1.0253,false],[1,21,43,436,3.3087,0.9796,false],[1,21,72,133,1.7934,1.0785,true],[1,22,57,118,1.4748,1.0747,true],[1,23,43,546,3.896,0.9842,false],[1,23,48,623,3.8685,0.9926,false],[1,23,58,591,3.8652,0.978,false],[1,23,77,80,1.3619,1.0239,true],[1,24,31,225,4.2279,0.995,false],[1,24,46,252,3.3293,0.9842,false],[1,24,66,116,2.7263,1.0196,true],[1,24,74,441,6.3855,0.9486,false],[1,25,30,287,2.5204,0.9936,false],[1,25,69,179,2.6822,1.0426,true],[1,25,74,239,2.8644,1.0623,false],[1,27,32,122,4.2361,0.9479,true],[1,27,40,160,3.2642,0.943,true],[1,27,43,157,3.7612,0.9467,true],[1,27,47,148,4.0259,1.0222,true],[1,27,53,190,3.4051,0.9308,true],[1,27,59,115,4.0483,1.06,true],[1,28,31,85,2.9233,1.0568,true],[1,28,66,102,4.3876,0.8917,true],[1,28,74,109,2.8887,1.0123,true],[1,29,30,392,3.6652,1.0476,false],[1,29,54,352,3.5504,1.0204,false],[1,29,57,725,3.095,1.0059,false],[1,29,69,222,3.5417,1.0265,false],[1,30,32,201,3.6368,0.9642,false],[1,30,33,376,3.1309,0.985,false],[1,30,36,332,3.2735,0.9702,false],[1,30,43,301,3.7576,0.9685,false],[1,30,71,86,1.642,1.0826,true],[1,30,73,158,3.373,1.0813,true],[1,31,45,111,3.7133,1.0158,true],[1,31,46,159,3.7353,0.9687,tru